{
  "id": "xerxes1",
  "names": {
    "ru": "Ксеркс I"
  },
  "role": "emperor",
  "realm": "persia",
  "reign": {
    "start": -486,
    "end": -465,
    "note": "Артаксеркс синодального Есфирь = Ахашверош; события Есфири"
  },
  "periodIds": [
    "persian"
  ],
  "bibleRefs": [
    "Есф 1:1"
  ]
}