{
  "id": "jehoahaz-israel",
  "names": {
    "ru": "Иоахаз Израильский"
  },
  "role": "king",
  "realm": "israel",
  "reign": {
    "start": -814,
    "end": -798
  },
  "periodIds": [
    "divided-kingdom"
  ],
  "assessment": "evil",
  "relations": {
    "dynasty": "jehu",
    "successor": "jehoash-israel"
  }
}