{
  "id": "samuel",
  "names": {
    "ru": "Самуил"
  },
  "role": "prophet",
  "realm": "united",
  "ministry": {
    "start": -1075,
    "end": -1017,
    "approx": true,
    "note": "последний судья и пророк"
  },
  "periodIds": [
    "judges",
    "united-kingdom"
  ],
  "placeIds": [
    "shiloh",
    "mizpah-judah"
  ]
}