{
  "id": "joram-israel",
  "names": {
    "ru": "Иорам Израильский"
  },
  "role": "king",
  "realm": "israel",
  "reign": {
    "start": -852,
    "end": -841
  },
  "periodIds": [
    "divided-kingdom"
  ],
  "assessment": "evil",
  "relations": {
    "dynasty": "omride",
    "successor": "jehu"
  }
}