{
  "id": "cyrus2",
  "names": {
    "ru": "Кир II Великий"
  },
  "role": "emperor",
  "realm": "persia",
  "reign": {
    "start": -539,
    "end": -530,
    "note": "указ о возвращении 538 (цилиндр Кира); назван по имени за ~150 лет (Ис 44:28-45:1)"
  },
  "periodIds": [
    "exile",
    "persian"
  ],
  "bibleRefs": [
    "Езд 1:1-4",
    "Ис 45:1"
  ]
}