{
  "id": "belshazzar",
  "names": {
    "ru": "Валтасар"
  },
  "role": "emperor",
  "realm": "babylon",
  "reign": {
    "start": -553,
    "end": -539,
    "note": "соправитель Набонида (цилиндры Набонида подтвердили историчность — классика библейской апологетики); пир и падение Вавилона"
  },
  "periodIds": [
    "exile"
  ],
  "bibleRefs": [
    "Дан 5"
  ]
}