{
  "id": "sennacherib",
  "names": {
    "ru": "Синаххериб"
  },
  "role": "emperor",
  "realm": "assyria",
  "reign": {
    "start": -705,
    "end": -681,
    "note": "поход 701: Лахис, осада Иерусалима, гибель войска (призма Тейлора молчит о взятии — согласуется с 4 Цар 19)"
  },
  "periodIds": [
    "judah-alone"
  ],
  "bibleRefs": [
    "4 Цар 18-19",
    "Ис 36-37"
  ]
}