{
  "id": "nebuchadnezzar2",
  "names": {
    "ru": "Навуходоносор II"
  },
  "role": "emperor",
  "realm": "babylon",
  "reign": {
    "start": -605,
    "end": -562,
    "note": "Кархемиш 605; депортации 605/597/586; сны Дан 2 и 4"
  },
  "periodIds": [
    "judah-alone",
    "exile"
  ],
  "bibleRefs": [
    "Дан 1-4",
    "4 Цар 24-25"
  ]
}